{
  "version": "1.0.0",
  "generated_at": "2026-08-16T00:00:00Z",
  "epistemic_status": "reference_only/non_evidence",
  "sources": [
    {"id":"triz-ref-inventive-principles-2023","title":"40 Inventive Principles with 132 illustrated examples","authors":["Dr Robert Adunka"],"publication":{"year":2023,"publisher":"TRIZ Consulting Group GmbH","date_status":"verified"},"artifact":{"filename":"40InventivePrinciples_v1_lowRes.pdf","sha256":"066e12e00dbab2e514029439bbf849bffb5c6516981f0fe3192d84406f25b7cb","size_bytes":1152379,"pages":46,"repository_copy_tracked":false},"authority_class":"expert-authored_public_reference","authority_status":"verified_primary_source","rights":{"status":"copyrighted_public_download","open_license":false,"distribution_note":"The author publishes this exact PDF as a free download, but retains copyright and states no open redistribution license; the repository tracks metadata and independently written summaries only."},"citation":{"landing_url":"https://www.triz-consulting.de/2023/11/06/40-innovation-principles-in-132-illustrated-examples-for-free-download/?lang=en","artifact_url":"https://www.triz-consulting.de/wp-content/uploads/2023/10/40InventivePrinciples_v1_lowRes.pdf"},"intended_roles":["prompt_design","test_design","interpretation_context"],"automatic_ground_truth":false,"r2_frozen_protocol_eligible":false,"future_tranche":"R3/EXP-001","exposure_modes":["metadata_only","human_reviewed_excerpt","citation_only"],"locators":[{"label":"Principles and illustrated examples","page":1,"purpose":"One principle per page through page 40"},{"label":"Physical-contradiction workflow","page":41,"purpose":"Separation and contradiction-resolution sequence"},{"label":"Separation-to-principle crosswalk","page":42,"purpose":"Litvin-attributed recommendations"},{"label":"Fayer grouping","page":43,"purpose":"Principle grouping continued through page 44"},{"label":"40IP application","page":45,"purpose":"Reference implementation context"},{"label":"Publication notice","page":46,"purpose":"Authorship and distribution context"}]},
    {"id":"triz-ref-matrix-2003","title":"Matrix 2003: Updating the TRIZ Contradiction Matrix","authors":["Darrell Mann","Simon Dewulf","Boris Zlotin","Alla Zusman"],"publication":{"year":2003,"publisher":"CREAX Press","date_status":"verified"},"artifact":{"filename":"matrix2003-eng_v4.pdf","sha256":"65fc567d9d76b95d462fa0e89bddac8d0db481780691d90ec11a06c9e75b32c8","size_bytes":230191,"pages":1,"repository_copy_tracked":false},"authority_class":"expert-curated_public_reference","authority_status":"verified_provider_attribution","rights":{"status":"permission_reported_no_general_open_license","open_license":false,"distribution_note":"TRIZ Consulting Group reports permission from Darrell Mann to provide the 2003 matrix, but no general open license or Apache-compatible redistribution grant; the repository tracks metadata only."},"citation":{"landing_url":"https://www.triz-consulting.de/about-triz/triz-matrix/?lang=en","artifact_url":"https://www.triz-consulting.de/wp-content/uploads/2021/09/matrix2003-eng_v4.pdf"},"intended_roles":["prompt_design","test_design","taxonomy_context"],"automatic_ground_truth":false,"r2_frozen_protocol_eligible":false,"future_tranche":"R3/EXP-001","exposure_modes":["metadata_only","human_reviewed_excerpt","citation_only"],"locators":[{"label":"48 by 48 contradiction matrix","page":1,"purpose":"Updated parameter-pair recommendations for future test design"}]},
    {"id":"triz-ref-tools-overview-panitz","title":"TRIZ Tools Overview with main interactions","authors":["Gregor Panitz"],"publication":{"year":null,"publisher":"Unverified user-supplied artifact","date_status":"unverified"},"artifact":{"filename":"Triz Tools flow and relationship - Gregor Panitz.pdf","sha256":"9e3f916a4801db039912e4a93b8778704703f9a94354c46db8961d36f7568c43","size_bytes":78578,"pages":1,"repository_copy_tracked":false},"authority_class":"expert-authored_public_reference","authority_status":"user_attributed_not_independently_verified","rights":{"status":"rights_unverified","open_license":false,"distribution_note":"The artifact was supplied by the repository owner and attributed to Gregor Panitz; no canonical artifact URL, publication date, or open redistribution license has been independently verified."},"citation":{"landing_url":"https://inventissimo.de/","artifact_url":null},"intended_roles":["prompt_design","test_design","tool_relationship_context"],"automatic_ground_truth":false,"r2_frozen_protocol_eligible":false,"future_tranche":"R3/EXP-001","exposure_modes":["metadata_only","human_reviewed_excerpt","citation_only"],"locators":[{"label":"Tool flow and relationships","page":1,"purpose":"Expert conceptual context for future tool-sequencing tests"}]}
  ]
}
